{
  "$schema": "./schema.json",
  "title": "starvation",
  "cooldown": 10,
  "trigger": {
    "comparator": "gt",
    "target": "population",
    "value": 4
  },
  "events": {
    "start": {
      "text": "Your species is starving. #yumt26",
      "effects": {
        "reduce_growth": true
      },
      "choices": [
        {
          "text": "Do nothing. Let the strongest survive. #6f07dh",
          "next": [
            {
              "event": "choice_strongest",
              "in": 2
            }
          ]
        },
        {
          "text": "Show them how to hunt bigger prey, and so, climb the food chain. #p9n0wu",
          "next": [
            {
              "event": "choice_hunt_success",
              "in": 1
            },
            {
              "weight": 2,
              "event": "choice_hunt_failure",
              "in": 1
            }
          ]
        }
      ]
    },
    "choice_strongest": {
      "text": "You watch as your species is starving, but slowly adapting to the situation afterwards. #0sxx18",
      "next": [
        {
          "event": "choice_strongest_end"
        }
      ]
    },
    "choice_strongest_end": {
      "text": "The famine has ended as a lot of members died. #8ripkx",
      "effects": {
        "reduce_growth": false
      }
    },
    "choice_hunt_success": {
      "text": "They are better hunters now. #r3tl7p",
      "effects": {
        "better_hunting": true
      }
    },
    "choice_hunt_failure": {
      "text": "Your species is dying while trying to hunt. #k67y76",
      "effects": {
        "decrease_in_food_chain": true
      }
    }
  },
  "effects": {
    "reduce_growth": {
      "description": "You watch as your species is starving, but slowly adapting to the situation afterwards.",
      "operation": "subtract",
      "target": "population",
      "value": 1,
      "type": "permanent"
    },
    "better_hunting": {
      "description": "They are better hunters.",
      "operation": "add",
      "target": "population",
      "value": 1,
      "type": "permanent"
    },
    "decrease_in_food_chain": {
      "description": "Hunters are being hunted.",
      "operation": "subtract",
      "target": "population",
      "value": 1,
      "type": "instant"
    }
  }
}