{
  "$schema": "./schema.json",
  "title": "Request additional funding",
  "cooldown": 999,
  "trigger": {
    "target": "money",
    "comparator": "lte",
    "value": 10
  },
  "events": {
    "start": {
      "text": "Aude: “Wake up, the project bank account is low, you need to do something about it“",
      "choices": [
        {
          "text": "“Do you expect me to magically make money appear ?“",
          "next": [
            {
              "event": "talk-with-aude"
            }
          ]
        },
        {
          "text": "“You're right, only bad things will happen if I don't solve this.“",
          "next": [
            {
              "event": "aude-tells-you"
            }
          ]
        }
      ]
    },
    "talk-with-aude": {
      "text": "Aude: “I am designed to help you with these type of issues. Do have I to remember WHO MADE ME ?“",
      "choices": [
        {
          "text": "“I would never dare questioning your judgment.“",
          "next": [
            {
              "event": "aude-tells-you"
            }
          ]
        },
        {
          "text": "“Whatever..“",
          "next": [
            {
              "event": "aude-tells-you"
            }
          ]
        }
      ]
    },
    "aude-tells-you": {
      "text": "Aude: “You probably know what you should do, even if you're not enjoyed to. Have a bit of courage and go on with it.“",
      "choices": [
        {
          "text": "“I suppose I have no other choices..“",
          "next": [
            {
              "event": "request-funding"
            }
          ]
        }
      ]
    },
    "request-funding": {
      "text": "You spend way too much time finding out who to contact and to write the actual mail.",
      "choices": [
        {
          "text": "Ask to meet the company board to request more funding.",
          "next": [
            {
              "event": "board-meeting-accepted"
            }
          ]
        }
      ]
    },
    "board-meeting": {
      "text": "You quickly push stuff away from you webcam frame, in a vain effort to make your office look tidy.\nThe space-web meeting is about to start.\n",
      "choices": [
        {
          "text": "Connect to the meeting",
          "next": []
        }
      ]
    },
    "board-meeting-accepted": {
      "text": "You receive a (way too)fast positive response, the board has 5 minutes to spare between two meetings in.. 5 minutes.",
      "next": [
        {
          "event": "board-meeting"
        }
      ]
    }
  },
  "effects": {}
}